{
  "schemaVersion": 1,
  "studioId": "4-studio-audiovisual-vila-velha-54a55c",
  "discovery": {
    "attempts": [
      {
        "at": "2026-08-13T04:49:30Z",
        "method": "source_import",
        "url": "http://instagram.com/4studioaudiovisual",
        "result": "social_profile_from_source"
      }
    ],
    "selectedProfiles": {
      "instagram": {
        "value": "http://instagram.com/4studioaudiovisual",
        "sourceUrl": "http://instagram.com/4studioaudiovisual",
        "sourceType": "source_json",
        "collectedAt": "2026-08-13T04:49:30Z",
        "confidence": 0.95
      }
    },
    "requiresHumanReview": false
  },
  "social": {
    "highlights": [],
    "posts": []
  },
  "facts": {
    "description": [
      {
        "value": "4° Studio Audiovisual é um estúdio musical localizado em Vila Velha, Espírito Santo.",
        "sourceUrl": "https://www.google.com/maps/search/?api=1&query=-20.3552751%2C-40.3455884",
        "sourceType": "source_json",
        "collectedAt": "2026-08-13T04:49:30Z",
        "confidence": 0.95
      }
    ],
    "equipment": [],
    "prices": [],
    "openingHours": [],
    "googleReviews": [
      {
        "value": {
          "rating": 4.8,
          "count": 72
        },
        "sourceUrl": "https://www.google.com/maps/search/?api=1&query=-20.3552751%2C-40.3455884",
        "sourceType": "source_json",
        "collectedAt": "2026-08-13T04:49:30Z",
        "confidence": 0.95
      }
    ],
    "map": [
      {
        "value": {
          "latitude": -20.3552751,
          "longitude": -40.3455884,
          "address": "R. Olíbia Moreira Rodrigues, 325 - Jardim Marilandia, Vila Velha - ES, 29112-015, Brazil"
        },
        "sourceUrl": "https://www.google.com/maps/search/?api=1&query=-20.3552751%2C-40.3455884",
        "sourceType": "source_json",
        "collectedAt": "2026-08-13T04:49:30Z",
        "confidence": 0.95
      }
    ]
  },
  "media": {
    "candidates": [],
    "selected": []
  },
  "warnings": [
    {
      "code": "SOURCE_ONLY_BATCH",
      "message": "Página gerada somente com fatos presentes na fonte; mídia, preços, horários e equipamentos não confirmados foram omitidos.",
      "stage": "batch",
      "at": "2026-08-13T04:49:30Z",
      "retryable": false
    }
  ],
  "completedAt": "2026-08-13T04:49:30Z"
}
