{
  "schemaVersion": 1,
  "studioId": "dvel-studio-sao-jose-dos-bf11e1",
  "discovery": {
    "attempts": [
      {
        "at": "2026-08-13T04:49:30Z",
        "method": "source_import",
        "url": "https://instagram.com/estudiodvel",
        "result": "social_profile_from_source"
      }
    ],
    "selectedProfiles": {
      "instagram": {
        "value": "https://instagram.com/estudiodvel",
        "sourceUrl": "https://instagram.com/estudiodvel",
        "sourceType": "source_json",
        "collectedAt": "2026-08-13T04:49:30Z",
        "confidence": 0.95
      }
    },
    "requiresHumanReview": false
  },
  "social": {
    "highlights": [],
    "posts": []
  },
  "facts": {
    "description": [
      {
        "value": "DVEL Studio é um estúdio musical localizado em São José dos Campos, São Paulo.",
        "sourceUrl": "https://www.google.com/maps/search/?api=1&query=-23.1791509%2C-45.877907799999996",
        "sourceType": "source_json",
        "collectedAt": "2026-08-13T04:49:30Z",
        "confidence": 0.95
      }
    ],
    "equipment": [],
    "prices": [],
    "openingHours": [],
    "googleReviews": [
      {
        "value": {
          "rating": 4.8,
          "count": 54
        },
        "sourceUrl": "https://www.google.com/maps/search/?api=1&query=-23.1791509%2C-45.877907799999996",
        "sourceType": "source_json",
        "collectedAt": "2026-08-13T04:49:30Z",
        "confidence": 0.95
      }
    ],
    "map": [
      {
        "value": {
          "latitude": -23.1791509,
          "longitude": -45.877907799999996,
          "address": "R. Piracicaba, 83 - Centro, São José dos Campos - SP, 12210-240, Brazil"
        },
        "sourceUrl": "https://www.google.com/maps/search/?api=1&query=-23.1791509%2C-45.877907799999996",
        "sourceType": "source_json",
        "collectedAt": "2026-08-13T04:49:30Z",
        "confidence": 0.95
      }
    ]
  },
  "media": {
    "candidates": [],
    "selected": []
  },
  "warnings": [
    {
      "code": "SOURCE_ONLY_BATCH",
      "message": "Página gerada somente com fatos presentes na fonte; mídia, preços, horários e equipamentos não confirmados foram omitidos.",
      "stage": "batch",
      "at": "2026-08-13T04:49:30Z",
      "retryable": false
    }
  ],
  "completedAt": "2026-08-13T04:49:30Z"
}
