{
  "schemaVersion": 1,
  "studioId": "pedra-sonora-estudio-biguacu-3f0e20",
  "discovery": {
    "attempts": [
      {
        "at": "2026-08-13T04:49:30Z",
        "method": "source_import",
        "url": "http://www.facebook.com/pedrasonoraestudio",
        "result": "social_profile_from_source"
      }
    ],
    "selectedProfiles": {
      "facebook": {
        "value": "http://www.facebook.com/pedrasonoraestudio",
        "sourceUrl": "http://www.facebook.com/pedrasonoraestudio",
        "sourceType": "source_json",
        "collectedAt": "2026-08-13T04:49:30Z",
        "confidence": 0.95
      }
    },
    "requiresHumanReview": false
  },
  "social": {
    "highlights": [],
    "posts": []
  },
  "facts": {
    "description": [
      {
        "value": "Pedra Sonora Estudio é um estúdio musical localizado em Biguaçu, Santa Catarina.",
        "sourceUrl": "https://www.google.com/maps/search/?api=1&query=-27.4544864%2C-48.3959622",
        "sourceType": "source_json",
        "collectedAt": "2026-08-13T04:49:30Z",
        "confidence": 0.95
      }
    ],
    "equipment": [],
    "prices": [],
    "openingHours": [],
    "googleReviews": [
      {
        "value": {
          "rating": 4.9,
          "count": 75
        },
        "sourceUrl": "https://www.google.com/maps/search/?api=1&query=-27.4544864%2C-48.3959622",
        "sourceType": "source_json",
        "collectedAt": "2026-08-13T04:49:30Z",
        "confidence": 0.95
      }
    ],
    "map": [
      {
        "value": {
          "latitude": -27.4544864,
          "longitude": -48.3959622,
          "address": "Serv Valdevino Marques Da Natividade número 870 - Ingleses do Río Vermelho, Florianópolis - SC, 88058-483, Brazil"
        },
        "sourceUrl": "https://www.google.com/maps/search/?api=1&query=-27.4544864%2C-48.3959622",
        "sourceType": "source_json",
        "collectedAt": "2026-08-13T04:49:30Z",
        "confidence": 0.95
      }
    ]
  },
  "media": {
    "candidates": [],
    "selected": []
  },
  "warnings": [
    {
      "code": "SOURCE_ONLY_BATCH",
      "message": "Página gerada somente com fatos presentes na fonte; mídia, preços, horários e equipamentos não confirmados foram omitidos.",
      "stage": "batch",
      "at": "2026-08-13T04:49:30Z",
      "retryable": false
    }
  ],
  "completedAt": "2026-08-13T04:49:30Z"
}
