{
  "schemaVersion": 1,
  "studioId": "estudio-mantra-vila-velha-48dc71",
  "discovery": {
    "attempts": [
      {
        "at": "2026-08-13T04:49:30Z",
        "method": "source_import",
        "url": "http://facebook.com/estudiomantramusic",
        "result": "social_profile_from_source"
      }
    ],
    "selectedProfiles": {
      "facebook": {
        "value": "http://facebook.com/estudiomantramusic",
        "sourceUrl": "http://facebook.com/estudiomantramusic",
        "sourceType": "source_json",
        "collectedAt": "2026-08-13T04:49:30Z",
        "confidence": 0.95
      }
    },
    "requiresHumanReview": false
  },
  "social": {
    "highlights": [],
    "posts": []
  },
  "facts": {
    "description": [
      {
        "value": "Estúdio Mantra é um estúdio musical localizado em Vila Velha, Espírito Santo.",
        "sourceUrl": "https://www.google.com/maps/search/?api=1&query=-20.260378799999998%2C-40.268018999999995",
        "sourceType": "source_json",
        "collectedAt": "2026-08-13T04:49:30Z",
        "confidence": 0.95
      }
    ],
    "equipment": [],
    "prices": [],
    "openingHours": [],
    "googleReviews": [
      {
        "value": {
          "rating": 4.7,
          "count": 64
        },
        "sourceUrl": "https://www.google.com/maps/search/?api=1&query=-20.260378799999998%2C-40.268018999999995",
        "sourceType": "source_json",
        "collectedAt": "2026-08-13T04:49:30Z",
        "confidence": 0.95
      }
    ],
    "map": [
      {
        "value": {
          "latitude": -20.260378799999998,
          "longitude": -40.268018999999995,
          "address": "Av. Ranulpho Barbosa dos Santos, 587 - Jardim Camburi, Vitória - ES, 29090-120, Brazil"
        },
        "sourceUrl": "https://www.google.com/maps/search/?api=1&query=-20.260378799999998%2C-40.268018999999995",
        "sourceType": "source_json",
        "collectedAt": "2026-08-13T04:49:30Z",
        "confidence": 0.95
      }
    ]
  },
  "media": {
    "candidates": [],
    "selected": []
  },
  "warnings": [
    {
      "code": "SOURCE_ONLY_BATCH",
      "message": "Página gerada somente com fatos presentes na fonte; mídia, preços, horários e equipamentos não confirmados foram omitidos.",
      "stage": "batch",
      "at": "2026-08-13T04:49:30Z",
      "retryable": false
    }
  ],
  "completedAt": "2026-08-13T04:49:30Z"
}
