{
  "schemaVersion": 1,
  "studioId": "estudio-matagal-sorocaba-8c447f",
  "discovery": {
    "attempts": [
      {
        "at": "2026-08-13T04:49:30Z",
        "method": "source_import",
        "url": "https://www.instagram.com/estudiomatagal/",
        "result": "social_profile_from_source"
      }
    ],
    "selectedProfiles": {
      "instagram": {
        "value": "https://www.instagram.com/estudiomatagal/",
        "sourceUrl": "https://www.instagram.com/estudiomatagal/",
        "sourceType": "source_json",
        "collectedAt": "2026-08-13T04:49:30Z",
        "confidence": 0.95
      }
    },
    "requiresHumanReview": false
  },
  "social": {
    "highlights": [],
    "posts": []
  },
  "facts": {
    "description": [
      {
        "value": "Estúdio Matagal é um estúdio musical localizado em Sorocaba, São Paulo.",
        "sourceUrl": "https://www.google.com/maps/search/?api=1&query=-23.550736099999998%2C-47.4519545",
        "sourceType": "source_json",
        "collectedAt": "2026-08-13T04:49:30Z",
        "confidence": 0.95
      }
    ],
    "equipment": [],
    "prices": [],
    "openingHours": [],
    "googleReviews": [
      {
        "value": {
          "rating": 5,
          "count": 47
        },
        "sourceUrl": "https://www.google.com/maps/search/?api=1&query=-23.550736099999998%2C-47.4519545",
        "sourceType": "source_json",
        "collectedAt": "2026-08-13T04:49:30Z",
        "confidence": 0.95
      }
    ],
    "map": [
      {
        "value": {
          "latitude": -23.550736099999998,
          "longitude": -47.4519545,
          "address": "R. Luiza Emilio, 180 - Vila Domingues, Votorantim - SP, 18116-725, Brazil"
        },
        "sourceUrl": "https://www.google.com/maps/search/?api=1&query=-23.550736099999998%2C-47.4519545",
        "sourceType": "source_json",
        "collectedAt": "2026-08-13T04:49:30Z",
        "confidence": 0.95
      }
    ]
  },
  "media": {
    "candidates": [],
    "selected": []
  },
  "warnings": [
    {
      "code": "SOURCE_ONLY_BATCH",
      "message": "Página gerada somente com fatos presentes na fonte; mídia, preços, horários e equipamentos não confirmados foram omitidos.",
      "stage": "batch",
      "at": "2026-08-13T04:49:30Z",
      "retryable": false
    }
  ],
  "completedAt": "2026-08-13T04:49:30Z"
}
