{
  "schemaVersion": 1,
  "studioId": "fusion-studio-ensaios-e-producoes-musicais-goiania-16be24",
  "discovery": {
    "attempts": [
      {
        "at": "2026-08-13T04:49:30Z",
        "method": "source_import",
        "url": "http://www.instagram.com/fusionstudio1",
        "result": "social_profile_from_source"
      }
    ],
    "selectedProfiles": {
      "instagram": {
        "value": "http://www.instagram.com/fusionstudio1",
        "sourceUrl": "http://www.instagram.com/fusionstudio1",
        "sourceType": "source_json",
        "collectedAt": "2026-08-13T04:49:30Z",
        "confidence": 0.95
      }
    },
    "requiresHumanReview": false
  },
  "social": {
    "highlights": [],
    "posts": []
  },
  "facts": {
    "description": [
      {
        "value": "Fusion Studio - Ensaios e Produções Musicais é um estúdio musical localizado em Goiânia, Goiás.",
        "sourceUrl": "https://www.google.com/maps/search/?api=1&query=-16.7418549%2C-49.2786714",
        "sourceType": "source_json",
        "collectedAt": "2026-08-13T04:49:30Z",
        "confidence": 0.95
      }
    ],
    "equipment": [],
    "prices": [],
    "openingHours": [],
    "googleReviews": [
      {
        "value": {
          "rating": 5,
          "count": 92
        },
        "sourceUrl": "https://www.google.com/maps/search/?api=1&query=-16.7418549%2C-49.2786714",
        "sourceType": "source_json",
        "collectedAt": "2026-08-13T04:49:30Z",
        "confidence": 0.95
      }
    ],
    "map": [
      {
        "value": {
          "latitude": -16.7418549,
          "longitude": -49.2786714,
          "address": "Ao lado do Buriti Shopping - Av. Dona Maria Cardoso, qd 101 - lt 07, sobreloja - Vila Sao Tomaz, Goiânia - GO, 74915-495, Brazil"
        },
        "sourceUrl": "https://www.google.com/maps/search/?api=1&query=-16.7418549%2C-49.2786714",
        "sourceType": "source_json",
        "collectedAt": "2026-08-13T04:49:30Z",
        "confidence": 0.95
      }
    ]
  },
  "media": {
    "candidates": [],
    "selected": []
  },
  "warnings": [
    {
      "code": "SOURCE_ONLY_BATCH",
      "message": "Página gerada somente com fatos presentes na fonte; mídia, preços, horários e equipamentos não confirmados foram omitidos.",
      "stage": "batch",
      "at": "2026-08-13T04:49:30Z",
      "retryable": false
    }
  ],
  "completedAt": "2026-08-13T04:49:30Z"
}
