{
  "schemaVersion": 1,
  "studioId": "totte-studio-timon-ae475d",
  "discovery": {
    "attempts": [
      {
        "at": "2026-08-13T04:49:30Z",
        "method": "source_import",
        "url": "https://instagram.com/tottestudio",
        "result": "social_profile_from_source"
      }
    ],
    "selectedProfiles": {
      "instagram": {
        "value": "https://instagram.com/tottestudio",
        "sourceUrl": "https://instagram.com/tottestudio",
        "sourceType": "source_json",
        "collectedAt": "2026-08-13T04:49:30Z",
        "confidence": 0.95
      }
    },
    "requiresHumanReview": false
  },
  "social": {
    "highlights": [],
    "posts": []
  },
  "facts": {
    "description": [
      {
        "value": "Totte Studio é um estúdio musical localizado em Timon, Maranhão.",
        "sourceUrl": "https://www.google.com/maps/search/?api=1&query=-5.0774297%2C-42.823307",
        "sourceType": "source_json",
        "collectedAt": "2026-08-13T04:49:30Z",
        "confidence": 0.95
      }
    ],
    "equipment": [],
    "prices": [],
    "openingHours": [],
    "googleReviews": [
      {
        "value": {
          "rating": 4.8,
          "count": 41
        },
        "sourceUrl": "https://www.google.com/maps/search/?api=1&query=-5.0774297%2C-42.823307",
        "sourceType": "source_json",
        "collectedAt": "2026-08-13T04:49:30Z",
        "confidence": 0.95
      }
    ],
    "map": [
      {
        "value": {
          "latitude": -5.0774297,
          "longitude": -42.823307,
          "address": "R. Rui Barbosa, 1873 - Pirajá, Teresina - PI, 64002-228, Brazil"
        },
        "sourceUrl": "https://www.google.com/maps/search/?api=1&query=-5.0774297%2C-42.823307",
        "sourceType": "source_json",
        "collectedAt": "2026-08-13T04:49:30Z",
        "confidence": 0.95
      }
    ]
  },
  "media": {
    "candidates": [],
    "selected": []
  },
  "warnings": [
    {
      "code": "SOURCE_ONLY_BATCH",
      "message": "Página gerada somente com fatos presentes na fonte; mídia, preços, horários e equipamentos não confirmados foram omitidos.",
      "stage": "batch",
      "at": "2026-08-13T04:49:30Z",
      "retryable": false
    }
  ],
  "completedAt": "2026-08-13T04:49:30Z"
}
