{
  "schemaVersion": 1,
  "studioId": "estudio-vox-bh-santa-luzia-664a04",
  "discovery": {
    "attempts": [
      {
        "at": "2026-08-13T04:49:30Z",
        "method": "source_import",
        "url": "https://alexandredamatagui.wixsite.com/estudiovoxbh",
        "result": "source_contact_only"
      }
    ],
    "selectedProfiles": {},
    "requiresHumanReview": false
  },
  "social": {
    "highlights": [],
    "posts": []
  },
  "facts": {
    "description": [
      {
        "value": "Estúdio Vox BH é um estúdio musical localizado em Santa Luzia, Minas Gerais.",
        "sourceUrl": "https://www.google.com/maps/search/?api=1&query=-19.842846599999998%2C-43.952180899999995",
        "sourceType": "source_json",
        "collectedAt": "2026-08-13T04:49:30Z",
        "confidence": 0.95
      }
    ],
    "equipment": [],
    "prices": [],
    "openingHours": [],
    "googleReviews": [
      {
        "value": {
          "rating": 4.8,
          "count": 36
        },
        "sourceUrl": "https://www.google.com/maps/search/?api=1&query=-19.842846599999998%2C-43.952180899999995",
        "sourceType": "source_json",
        "collectedAt": "2026-08-13T04:49:30Z",
        "confidence": 0.95
      }
    ],
    "map": [
      {
        "value": {
          "latitude": -19.842846599999998,
          "longitude": -43.952180899999995,
          "address": "R. Nélia, 292 - São Tomaz, Belo Horizonte - MG, 31741-130, Brazil"
        },
        "sourceUrl": "https://www.google.com/maps/search/?api=1&query=-19.842846599999998%2C-43.952180899999995",
        "sourceType": "source_json",
        "collectedAt": "2026-08-13T04:49:30Z",
        "confidence": 0.95
      }
    ]
  },
  "media": {
    "candidates": [],
    "selected": []
  },
  "warnings": [
    {
      "code": "SOURCE_ONLY_BATCH",
      "message": "Página gerada somente com fatos presentes na fonte; mídia, preços, horários e equipamentos não confirmados foram omitidos.",
      "stage": "batch",
      "at": "2026-08-13T04:49:30Z",
      "retryable": false
    }
  ],
  "completedAt": "2026-08-13T04:49:30Z"
}
