{
  "schemaVersion": 1,
  "studioId": "kr-lab-studio-ananindeua-adc88b",
  "discovery": {
    "attempts": [
      {
        "at": "2026-08-13T04:49:30Z",
        "method": "source_import",
        "url": "https://www.instagram.com/kadinhoprodutor/",
        "result": "social_profile_from_source"
      }
    ],
    "selectedProfiles": {
      "instagram": {
        "value": "https://www.instagram.com/kadinhoprodutor/",
        "sourceUrl": "https://www.instagram.com/kadinhoprodutor/",
        "sourceType": "source_json",
        "collectedAt": "2026-08-13T04:49:30Z",
        "confidence": 0.95
      }
    },
    "requiresHumanReview": false
  },
  "social": {
    "highlights": [],
    "posts": []
  },
  "facts": {
    "description": [
      {
        "value": "KR Lab Studio é um estúdio musical localizado em Ananindeua, Pará.",
        "sourceUrl": "https://www.google.com/maps/search/?api=1&query=-1.3690554%2C-48.439330299999995",
        "sourceType": "source_json",
        "collectedAt": "2026-08-13T04:49:30Z",
        "confidence": 0.95
      }
    ],
    "equipment": [],
    "prices": [],
    "openingHours": [],
    "googleReviews": [
      {
        "value": {
          "rating": 5,
          "count": 24
        },
        "sourceUrl": "https://www.google.com/maps/search/?api=1&query=-1.3690554%2C-48.439330299999995",
        "sourceType": "source_json",
        "collectedAt": "2026-08-13T04:49:30Z",
        "confidence": 0.95
      }
    ],
    "map": [
      {
        "value": {
          "latitude": -1.3690554,
          "longitude": -48.439330299999995,
          "address": "R. Wg-7, 8 - Parque Verde, Belém - PA, 66633-620, Brazil"
        },
        "sourceUrl": "https://www.google.com/maps/search/?api=1&query=-1.3690554%2C-48.439330299999995",
        "sourceType": "source_json",
        "collectedAt": "2026-08-13T04:49:30Z",
        "confidence": 0.95
      }
    ]
  },
  "media": {
    "candidates": [],
    "selected": []
  },
  "warnings": [
    {
      "code": "SOURCE_ONLY_BATCH",
      "message": "Página gerada somente com fatos presentes na fonte; mídia, preços, horários e equipamentos não confirmados foram omitidos.",
      "stage": "batch",
      "at": "2026-08-13T04:49:30Z",
      "retryable": false
    }
  ],
  "completedAt": "2026-08-13T04:49:30Z"
}
