{
  "schemaVersion": 1,
  "studioId": "studio-morada-vila-velha-6aa577",
  "discovery": {
    "attempts": [
      {
        "at": "2026-08-13T04:49:30Z",
        "method": "source_import",
        "url": "https://www.facebook.com/leonardo.trevelin",
        "result": "social_profile_from_source"
      }
    ],
    "selectedProfiles": {
      "facebook": {
        "value": "https://www.facebook.com/leonardo.trevelin",
        "sourceUrl": "https://www.facebook.com/leonardo.trevelin",
        "sourceType": "source_json",
        "collectedAt": "2026-08-13T04:49:30Z",
        "confidence": 0.95
      }
    },
    "requiresHumanReview": false
  },
  "social": {
    "highlights": [],
    "posts": []
  },
  "facts": {
    "description": [
      {
        "value": "Studio Morada é um estúdio musical localizado em Vila Velha, Espírito Santo.",
        "sourceUrl": "https://www.google.com/maps/search/?api=1&query=-20.3501801%2C-40.391708799999996",
        "sourceType": "source_json",
        "collectedAt": "2026-08-13T04:49:30Z",
        "confidence": 0.95
      }
    ],
    "equipment": [],
    "prices": [],
    "openingHours": [],
    "googleReviews": [
      {
        "value": {
          "rating": 4.8,
          "count": 105
        },
        "sourceUrl": "https://www.google.com/maps/search/?api=1&query=-20.3501801%2C-40.391708799999996",
        "sourceType": "source_json",
        "collectedAt": "2026-08-13T04:49:30Z",
        "confidence": 0.95
      }
    ],
    "map": [
      {
        "value": {
          "latitude": -20.3501801,
          "longitude": -40.391708799999996,
          "address": "389, R. Silvia Santos, 351, Cariacica - ES, Brazil"
        },
        "sourceUrl": "https://www.google.com/maps/search/?api=1&query=-20.3501801%2C-40.391708799999996",
        "sourceType": "source_json",
        "collectedAt": "2026-08-13T04:49:30Z",
        "confidence": 0.95
      }
    ]
  },
  "media": {
    "candidates": [],
    "selected": []
  },
  "warnings": [
    {
      "code": "SOURCE_ONLY_BATCH",
      "message": "Página gerada somente com fatos presentes na fonte; mídia, preços, horários e equipamentos não confirmados foram omitidos.",
      "stage": "batch",
      "at": "2026-08-13T04:49:30Z",
      "retryable": false
    }
  ],
  "completedAt": "2026-08-13T04:49:30Z"
}
