{
  "schemaVersion": 1,
  "studioId": "la-cueva-records-apui-8d973d",
  "discovery": {
    "attempts": [
      {
        "at": "2026-08-13T04:49:30Z",
        "method": "source_import",
        "url": "https://www.instagram.com/lacuevarecords/",
        "result": "social_profile_from_source"
      }
    ],
    "selectedProfiles": {
      "instagram": {
        "value": "https://www.instagram.com/lacuevarecords/",
        "sourceUrl": "https://www.instagram.com/lacuevarecords/",
        "sourceType": "source_json",
        "collectedAt": "2026-08-13T04:49:30Z",
        "confidence": 0.95
      }
    },
    "requiresHumanReview": false
  },
  "social": {
    "highlights": [],
    "posts": []
  },
  "facts": {
    "description": [
      {
        "value": "La Cueva Records é um estúdio musical localizado em Apuí, Amazonas.",
        "sourceUrl": "https://www.google.com/maps/search/?api=1&query=25.8266679%2C-80.360322",
        "sourceType": "source_json",
        "collectedAt": "2026-08-13T04:49:30Z",
        "confidence": 0.95
      }
    ],
    "equipment": [],
    "prices": [],
    "openingHours": [],
    "googleReviews": [
      {
        "value": {
          "rating": 4.7,
          "count": 36
        },
        "sourceUrl": "https://www.google.com/maps/search/?api=1&query=25.8266679%2C-80.360322",
        "sourceType": "source_json",
        "collectedAt": "2026-08-13T04:49:30Z",
        "confidence": 0.95
      }
    ],
    "map": [
      {
        "value": {
          "latitude": 25.8266679,
          "longitude": -80.360322,
          "address": "10171 NW 58th St, Doral, FL 33178"
        },
        "sourceUrl": "https://www.google.com/maps/search/?api=1&query=25.8266679%2C-80.360322",
        "sourceType": "source_json",
        "collectedAt": "2026-08-13T04:49:30Z",
        "confidence": 0.95
      }
    ]
  },
  "media": {
    "candidates": [],
    "selected": []
  },
  "warnings": [
    {
      "code": "SOURCE_ONLY_BATCH",
      "message": "Página gerada somente com fatos presentes na fonte; mídia, preços, horários e equipamentos não confirmados foram omitidos.",
      "stage": "batch",
      "at": "2026-08-13T04:49:30Z",
      "retryable": false
    }
  ],
  "completedAt": "2026-08-13T04:49:30Z"
}
