{
  "schemaVersion": 1,
  "studioId": "groove-estudio-mogi-das-cru-29fa72",
  "discovery": {
    "attempts": [
      {
        "at": "2026-08-13T04:49:30Z",
        "method": "source_import",
        "url": "https://instagram.com/_grooveestudio",
        "result": "social_profile_from_source"
      }
    ],
    "selectedProfiles": {
      "instagram": {
        "value": "https://instagram.com/_grooveestudio",
        "sourceUrl": "https://instagram.com/_grooveestudio",
        "sourceType": "source_json",
        "collectedAt": "2026-08-13T04:49:30Z",
        "confidence": 0.95
      }
    },
    "requiresHumanReview": false
  },
  "social": {
    "highlights": [],
    "posts": []
  },
  "facts": {
    "description": [
      {
        "value": "Groove Estúdio é um estúdio musical localizado em Mogi das Cruzes, São Paulo.",
        "sourceUrl": "https://www.google.com/maps/search/?api=1&query=-23.541853999999997%2C-46.229997499999996",
        "sourceType": "source_json",
        "collectedAt": "2026-08-13T04:49:30Z",
        "confidence": 0.95
      }
    ],
    "equipment": [],
    "prices": [],
    "openingHours": [],
    "googleReviews": [
      {
        "value": {
          "rating": 4.6,
          "count": 25
        },
        "sourceUrl": "https://www.google.com/maps/search/?api=1&query=-23.541853999999997%2C-46.229997499999996",
        "sourceType": "source_json",
        "collectedAt": "2026-08-13T04:49:30Z",
        "confidence": 0.95
      }
    ],
    "map": [
      {
        "value": {
          "latitude": -23.541853999999997,
          "longitude": -46.229997499999996,
          "address": "Av. Alexandrina de Paula, 368 - Vila Nova Cintra, Mogi das Cruzes - SP, 08744-090, Brazil"
        },
        "sourceUrl": "https://www.google.com/maps/search/?api=1&query=-23.541853999999997%2C-46.229997499999996",
        "sourceType": "source_json",
        "collectedAt": "2026-08-13T04:49:30Z",
        "confidence": 0.95
      }
    ]
  },
  "media": {
    "candidates": [],
    "selected": []
  },
  "warnings": [
    {
      "code": "SOURCE_ONLY_BATCH",
      "message": "Página gerada somente com fatos presentes na fonte; mídia, preços, horários e equipamentos não confirmados foram omitidos.",
      "stage": "batch",
      "at": "2026-08-13T04:49:30Z",
      "retryable": false
    }
  ],
  "completedAt": "2026-08-13T04:49:30Z"
}
