{
  "schemaVersion": 1,
  "studioId": "solange-almeida-studios-pacatuba-14e688",
  "discovery": {
    "attempts": [
      {
        "at": "2026-08-13T04:49:30Z",
        "method": "source_import",
        "url": "https://www.instagram.com/solangealmeida/?hl=pt-br",
        "result": "social_profile_from_source"
      }
    ],
    "selectedProfiles": {
      "instagram": {
        "value": "https://www.instagram.com/solangealmeida/?hl=pt-br",
        "sourceUrl": "https://www.instagram.com/solangealmeida/?hl=pt-br",
        "sourceType": "source_json",
        "collectedAt": "2026-08-13T04:49:30Z",
        "confidence": 0.95
      }
    },
    "requiresHumanReview": false
  },
  "social": {
    "highlights": [],
    "posts": []
  },
  "facts": {
    "description": [
      {
        "value": "Solange Almeida Studios é um estúdio musical localizado em Pacatuba, Ceará.",
        "sourceUrl": "https://www.google.com/maps/search/?api=1&query=-3.9109797%2C-38.4527572",
        "sourceType": "source_json",
        "collectedAt": "2026-08-13T04:49:30Z",
        "confidence": 0.95
      }
    ],
    "equipment": [],
    "prices": [],
    "openingHours": [],
    "googleReviews": [
      {
        "value": {
          "rating": 5,
          "count": 61
        },
        "sourceUrl": "https://www.google.com/maps/search/?api=1&query=-3.9109797%2C-38.4527572",
        "sourceType": "source_json",
        "collectedAt": "2026-08-13T04:49:30Z",
        "confidence": 0.95
      }
    ],
    "map": [
      {
        "value": {
          "latitude": -3.9109797,
          "longitude": -38.4527572,
          "address": "R. José Duarte, 100 - Urucunema, Eusébio - CE, 61763-490, Brazil"
        },
        "sourceUrl": "https://www.google.com/maps/search/?api=1&query=-3.9109797%2C-38.4527572",
        "sourceType": "source_json",
        "collectedAt": "2026-08-13T04:49:30Z",
        "confidence": 0.95
      }
    ]
  },
  "media": {
    "candidates": [],
    "selected": []
  },
  "warnings": [
    {
      "code": "SOURCE_ONLY_BATCH",
      "message": "Página gerada somente com fatos presentes na fonte; mídia, preços, horários e equipamentos não confirmados foram omitidos.",
      "stage": "batch",
      "at": "2026-08-13T04:49:30Z",
      "retryable": false
    }
  ],
  "completedAt": "2026-08-13T04:49:30Z"
}
